{
  "project": "StarGraph: Murder on the Orient Express Knowledge Graph Benchmark",
  "version": "1.1.0",
  "generated_at": "2026-09-01T23:20:00Z",
  "metadata": {
    "novel": "Murder on the Orient Express (东方快车谋杀案)",
    "author": "Agatha Christie",
    "total_chunks": 6,
    "total_nodes": 25,
    "total_edges": 48,
    "total_communities": 4
  },
  "nodes": [
    {
      "id": "entity:CASSETTI",
      "name": "雷切特 / 卡塞蒂 (Samuel Ratchett / Cassetti)",
      "type": "VICTIM_CRIMINAL",
      "category": "victim",
      "cabin": 2,
      "reveal_stage": 0,
      "surface_role": "美国富商 (声称遭恐吓重金求保)",
      "secret_role": "五年前阿姆斯特朗绑架撕票案首犯，逃脱法律制裁的恶魔",
      "description": "东方快车谋杀案被害人，身中12刀身亡。曾绑架杀害3岁女童黛西·阿姆斯特朗，致使阿姆斯特朗家破人亡。",
      "color": "#ef4444"
    },
    {
      "id": "entity:HERCULE_POIROT",
      "name": "赫丘勒·白罗 (Hercule Poirot)",
      "type": "DETECTIVE",
      "category": "investigator",
      "cabin": 1,
      "reveal_stage": 0,
      "surface_role": "比利时名侦探",
      "secret_role": "本案裁判官，最终选择维护人性的实质正义，向警方隐瞒真相",
      "description": "加莱车厢唯一的局外人侦探，通过缜密逻辑识破12人共谋闭环并洞悉人性的正义。",
      "color": "#3b82f6"
    },
    {
      "id": "entity:TWELVE_STAB_WOUNDS_HUB",
      "name": "【物证超级节点】12处深浅各异的刺伤",
      "type": "EVIDENCE_SUPER_HUB",
      "category": "evidence_hub",
      "cabin": 2,
      "reveal_stage": 0,
      "surface_role": "死者身上的离奇创口",
      "secret_role": "12人复仇陪审团共同行刑的铁证：有的致命、有的轻浅、左右手并存",
      "description": "现场最关键的法医物证：12处创口具有完全不同的力度、方向与手法，证明有多名凶手轮流刺击。",
      "color": "#dc2626"
    },
    {
      "id": "entity:PHYSICAL_EVIDENCES",
      "name": "【现场杂项物证】烧焦纸片 / H手帕 / 烟斗通条",
      "type": "EVIDENCE_COLLECTION",
      "category": "evidence_hub",
      "cabin": 2,
      "reveal_stage": 0,
      "surface_role": "散落车厢的混乱线索",
      "secret_role": "真伪混杂的线索：纸片指向阿姆斯特朗案，手帕属于公主，通条指向阿布思诺",
      "description": "现场发现的散落线索，初期用于互相混淆视听与误导侦探向外来刺客方向侦查。",
      "color": "#94a3b8"
    },
    {
      "id": "entity:MRS_HUBBARD",
      "name": "赫伯德夫人 / 琳达·亚登 (Mrs. Hubbard / Linda Arden)",
      "type": "SUSPECT_RINGMASTER",
      "category": "suspect",
      "cabin": 3,
      "reveal_stage": 1,
      "surface_role": "喧闹浮夸的美国老太太",
      "secret_role": "黛西的外祖母、著名悲剧女演员琳达·亚登（全盘复仇总策划）",
      "description": "策划12人陪审团复仇案的灵魂人物，假装包厢有男人闯入制造假线索。",
      "color": "#a855f7"
    },
    {
      "id": "entity:MARY_DEBENHAM",
      "name": "玛丽·德本汉 (Mary Debenham)",
      "type": "SUSPECT_INTELLECT",
      "category": "suspect",
      "cabin": 11,
      "reveal_stage": 1,
      "surface_role": "冷静理智的英国年轻家庭教师",
      "secret_role": "曾任阿姆斯特朗家秘书兼家庭教师，深爱黛西，复仇策划核心之一",
      "description": "表面与车上所有人素不相识，实为阿姆斯特朗家核心成员，与阿布思诺上校相恋。",
      "color": "#8b5cf6"
    },
    {
      "id": "entity:COLONEL_ARBURTHNOT",
      "name": "阿布思诺上校 (Colonel Arbuthnot)",
      "type": "SUSPECT_MILITARY",
      "category": "suspect",
      "cabin": 15,
      "reveal_stage": 1,
      "surface_role": "严肃守纪的英国印度驻军军官",
      "secret_role": "阿姆斯特朗上校的生死挚友与战友，发誓为战友全家复仇",
      "description": "案发时与麦奎恩畅谈政治互做伪证，因深爱玛丽·德本汉并誓为挚友讨回公道加入复仇。",
      "color": "#8b5cf6"
    },
    {
      "id": "entity:PIERRE_MICHEL",
      "name": "皮埃尔·米歇尔 (Pierre Michel)",
      "type": "SUSPECT_STAFF",
      "category": "suspect",
      "cabin": 0,
      "reveal_stage": 1,
      "surface_role": "辛普伦东方快车资深列车乘务员",
      "secret_role": "阿姆斯特朗家受冤自杀女仆苏珊的亲生父亲",
      "description": "利用乘务员职务之便为12名刺客开启车厢与掩护走廊动线。",
      "color": "#8b5cf6"
    },
    {
      "id": "entity:HECTOR_MCQUEEN",
      "name": "赫克特·麦奎恩 (Hector McQueen)",
      "type": "SUSPECT_SECRETARY",
      "category": "suspect",
      "cabin": 6,
      "reveal_stage": 1,
      "surface_role": "雷切特的年轻美国私人秘书",
      "secret_role": "负责阿姆斯特朗案的地方检察官之子，极度崇拜索尼娅·阿姆斯特朗",
      "description": "卧底在卡塞蒂身边掌握其行踪与恐吓信，负责下药并为阿布思诺上校提供不在场证明。",
      "color": "#8b5cf6"
    },
    {
      "id": "entity:EDWARD_MASTERMAN",
      "name": "爱德华·马斯特曼 (Edward Masterman)",
      "type": "SUSPECT_VALET",
      "category": "suspect",
      "cabin": 4,
      "reveal_stage": 1,
      "surface_role": "刻板正统的雷切特英国男仆",
      "secret_role": "阿姆斯特朗上校一战期间的勤务兵与管家",
      "description": "在上校死后痛恨卡塞蒂，与福卡雷利同住一室并互为不在场证明。",
      "color": "#8b5cf6"
    },
    {
      "id": "entity:PRINCESS_DRAGOMIROFF",
      "name": "娜塔丽亚·卓戈米罗夫公主 (Princess Dragomiroff)",
      "type": "SUSPECT_NOBLE",
      "category": "suspect",
      "cabin": 14,
      "reveal_stage": 1,
      "surface_role": "年迈体弱、丑陋威严的俄国流亡贵族",
      "secret_role": "琳达·亚登的挚友、黛西母亲索尼娅的教母",
      "description": "地位崇高，现场遗留的绣“H”手帕即属于她（俄文字母N），坚决支持诛杀凶犯。",
      "color": "#8b5cf6"
    },
    {
      "id": "entity:HILDEGARDE_SCHMIDT",
      "name": "希德加第·施密特 (Hildegarde Schmidt)",
      "type": "SUSPECT_MAID",
      "category": "suspect",
      "cabin": 8,
      "reveal_stage": 1,
      "surface_role": "卓戈米罗夫公主的德国忠厚女仆",
      "secret_role": "阿姆斯特朗家当年极受喜爱的厨师",
      "description": "指认假列车员制服扣子，为公主服务并刺下属于厨师的一刀。",
      "color": "#8b5cf6"
    },
    {
      "id": "entity:ANTONIO_FOSCARELLI",
      "name": "安东尼奥·福卡雷利 (Antonio Foscarelli)",
      "type": "SUSPECT_DRIVER",
      "category": "suspect",
      "cabin": 5,
      "reveal_stage": 1,
      "surface_role": "喋喋不休的意大利汽车推销员",
      "secret_role": "阿姆斯特朗家当年的司机，视小黛西如己出",
      "description": "极富义气的南欧司机，与马斯特曼互保不在场证明并参与刺杀。",
      "color": "#8b5cf6"
    },
    {
      "id": "entity:GRETA_OHLSSON",
      "name": "葛丽泰·奥尔森 (Greta Ohlsson)",
      "type": "SUSPECT_NURSE",
      "category": "suspect",
      "cabin": 10,
      "reveal_stage": 1,
      "surface_role": "胆小虔诚的瑞典传教士",
      "secret_role": "曾任小黛西·阿姆斯特朗的专职看护保姆",
      "description": "小黛西遇害给她造成终生心理创伤，与玛丽·德本汉互保不在场证明。",
      "color": "#8b5cf6"
    },
    {
      "id": "entity:CYRUS_HARDMAN",
      "name": "赛勒斯·哈德曼 (Cyrus Hardman)",
      "type": "SUSPECT_DETECTIVE",
      "category": "suspect",
      "cabin": 16,
      "reveal_stage": 1,
      "surface_role": "受雇于雷切特的美国私家侦探",
      "secret_role": "受冤跳楼自尽女仆苏珊生前的前男友/情人",
      "description": "借护卫之名卧底监视卡塞蒂，故意向白罗提供“深肤色假刺客”假口供。",
      "color": "#8b5cf6"
    },
    {
      "id": "entity:COUNT_ANDRENYI",
      "name": "安德烈尼伯爵 (Count Andrenyi)",
      "type": "SUSPECT_DIPLOMAT",
      "category": "suspect",
      "cabin": 13,
      "reveal_stage": 1,
      "surface_role": "享有外交豁免权的匈牙利贵族外交官",
      "secret_role": "为保护深爱的妻子（黛西姨妈），代替妻子刺下属于她的一刀",
      "description": "用油迹涂改妻子护照上的真名海伦娜（Helena -> Elena），坚决替妻复仇。",
      "color": "#8b5cf6"
    },
    {
      "id": "entity:COUNTESS_ANDRENYI",
      "name": "海伦娜·安德烈尼伯爵夫人 (Countess Andrenyi)",
      "type": "SUSPECT_INNOCENT",
      "category": "suspect",
      "cabin": 12,
      "reveal_stage": 1,
      "surface_role": "年轻貌美的匈牙利伯爵夫人",
      "secret_role": "索尼娅·阿姆斯特朗的亲妹妹、黛西的亲姨妈（海伦娜·哥登堡）",
      "description": "全车12人中唯一没有亲手刺下刀痕的人（由其丈夫伯爵代刺以避免其双手染血）。",
      "color": "#8b5cf6"
    },
    {
      "id": "entity:ARMSTRONG_TRAGEDY_HUB",
      "name": "【超级核心】阿姆斯特朗绑架惨案 (Armstrong Tragedy)",
      "type": "TRAGIC_SUPER_HUB",
      "category": "tragedy_hub",
      "cabin": null,
      "reveal_stage": 2,
      "surface_role": "5年前震惊全美的世纪惨案",
      "secret_role": "东方快车上全员复仇动机的唯一向心力核心源泉",
      "description": "卡塞蒂策划绑架杀害3岁黛西，摧毁了整个阿姆斯特朗家族，并在5年后引发东方快车正义裁决。",
      "color": "#eab308"
    },
    {
      "id": "entity:DAISY_ARMSTRONG",
      "name": "黛西·阿姆斯特朗 (Daisy Armstrong)",
      "type": "TRAGIC_VICTIM",
      "category": "tragedy_hub",
      "cabin": null,
      "reveal_stage": 2,
      "surface_role": "已故遇害女童",
      "secret_role": "12人复仇行动守护的灵魂象征",
      "description": "阿姆斯特朗上校与索尼娅的3岁独生女，5年前遭卡塞蒂绑架撕票。",
      "color": "#f59e0b"
    },
    {
      "id": "entity:SUSAN_NURSEMAID",
      "name": "苏珊 (Suzanne / Paulette)",
      "type": "TRAGIC_VICTIM",
      "category": "tragedy_hub",
      "cabin": null,
      "reveal_stage": 2,
      "surface_role": "已故无辜法国女仆",
      "secret_role": "米歇尔之女、哈德曼恋人，含冤跳楼引燃二人复仇决心",
      "description": "绑架案后被警方严酷审讯，不堪冤屈跳楼自尽。",
      "color": "#f59e0b"
    }
  ],
  "edges": [
    {
      "source": "entity:CASSETTI",
      "target": "entity:TWELVE_STAB_WOUNDS_HUB",
      "relation": "FATALLY_WOUNDED_BY",
      "label": "身中12处深浅刀伤",
      "weight": 1.0,
      "reveal_stage": 0,
      "truth_only": false,
      "category": "physical_evidence"
    },
    {
      "source": "entity:CASSETTI",
      "target": "entity:PHYSICAL_EVIDENCES",
      "relation": "ASSOCIATED_EVIDENCES",
      "label": "现场散落遗留物",
      "weight": 0.8,
      "reveal_stage": 0,
      "truth_only": false,
      "category": "physical_evidence"
    },
    {
      "source": "entity:MARY_DEBENHAM",
      "target": "entity:GRETA_OHLSSON",
      "relation": "ALIBI_MUTUAL",
      "label": "同室互证睡觉 (假不在场证明)",
      "weight": 0.5,
      "reveal_stage": 1,
      "truth_only": false,
      "category": "alibi_loop"
    },
    {
      "source": "entity:COLONEL_ARBURTHNOT",
      "target": "entity:HECTOR_MCQUEEN",
      "relation": "ALIBI_MUTUAL",
      "label": "吸烟室夜谈 (互为不在场证明)",
      "weight": 0.5,
      "reveal_stage": 1,
      "truth_only": false,
      "category": "alibi_loop"
    },
    {
      "source": "entity:EDWARD_MASTERMAN",
      "target": "entity:ANTONIO_FOSCARELLI",
      "relation": "ALIBI_MUTUAL",
      "label": "同住4/5号包厢互为证人",
      "weight": 0.5,
      "reveal_stage": 1,
      "truth_only": false,
      "category": "alibi_loop"
    },
    {
      "source": "entity:HILDEGARDE_SCHMIDT",
      "target": "entity:PRINCESS_DRAGOMIROFF",
      "relation": "ALIBI_MUTUAL",
      "label": "主仆侍奉互证",
      "weight": 0.6,
      "reveal_stage": 1,
      "truth_only": false,
      "category": "alibi_loop"
    },
    {
      "source": "entity:COUNT_ANDRENYI",
      "target": "entity:COUNTESS_ANDRENYI",
      "relation": "ALIBI_MUTUAL",
      "label": "夫妻全程在旁互证",
      "weight": 0.6,
      "reveal_stage": 1,
      "truth_only": false,
      "category": "alibi_loop"
    },
    {
      "source": "entity:CYRUS_HARDMAN",
      "target": "entity:PIERRE_MICHEL",
      "relation": "ALIBI_MUTUAL",
      "label": "走廊巡视口供互相印证",
      "weight": 0.5,
      "reveal_stage": 1,
      "truth_only": false,